{
  "profile_id": "seamless-standard-v1",
  "version": "1.0.0",
  "bound_snapshot_id": "sha256:e0601d763eeea285d268ec9e468d321c50c9d7faba53c8e7442a2fcc4159c812",
  "evaluation_mode": "seamless_standard_scenario",
  "description": "SEAMLESS standard scenario assumption profile: conditions safe Active Directory intranet reachability, protocol acceptance, and DACL write rights while strictly forbidding recovery_success, unverified distribution groups, and fictitious edges.",
  "forbidden_predicates": [
    "actor_authenticated",
    "actor_controlled",
    "admin_control",
    "control",
    "controlled_service",
    "delegated_context",
    "rbcd_descriptor",
    "rbcd_secret",
    "recovery_success",
    "relationship_exists",
    "source_admin_control",
    "source_authorized",
    "usable_identity"
  ],
  "rules": [
    {
      "rule_id": "rule-global-kdc-reachable",
      "predicate": "network_kdc_reachable",
      "taxonomy": "global",
      "subject_kind": null,
      "target_kind": null,
      "default_value": true,
      "provenance_reference": "policy://seamless/v1/network/kdc",
      "rationale": "Domain Controllers (KDCs) are network-reachable on port 88 within intranet",
      "metadata": {}
    },
    {
      "rule_id": "rule-global-rpc-reachable",
      "predicate": "network_rpc_reachable",
      "taxonomy": "global",
      "subject_kind": null,
      "target_kind": null,
      "default_value": true,
      "provenance_reference": "policy://seamless/v1/network/rpc",
      "rationale": "MS-RPC port 135/dynamic RPC reachable for directory/SAMR operations",
      "metadata": {}
    },
    {
      "rule_id": "rule-global-winrm-reachable",
      "predicate": "network_winrm_reachable",
      "taxonomy": "global",
      "subject_kind": null,
      "target_kind": null,
      "default_value": true,
      "provenance_reference": "policy://seamless/v1/network/winrm",
      "rationale": "WinRM ports 5985/5986 reachable to servers configured for remote management",
      "metadata": {}
    },
    {
      "rule_id": "rule-global-winrm-service-running",
      "predicate": "service_winrm_running",
      "taxonomy": "global",
      "subject_kind": null,
      "target_kind": null,
      "default_value": true,
      "provenance_reference": "policy://seamless/v1/service/winrm",
      "rationale": "WinRM service is running and listening on target computer",
      "metadata": {}
    },
    {
      "rule_id": "rule-global-asrep-request-accepted",
      "predicate": "asrep_request_accepted",
      "taxonomy": "global",
      "subject_kind": null,
      "target_kind": null,
      "default_value": true,
      "provenance_reference": "policy://seamless/v1/kerberos/asrep",
      "rationale": "KDC standard AS-REQ accepted for accounts with DONT_REQ_PREAUTH flag",
      "metadata": {}
    },
    {
      "rule_id": "rule-global-service-ticket-accepted",
      "predicate": "service_ticket_request_accepted",
      "taxonomy": "global",
      "subject_kind": null,
      "target_kind": null,
      "default_value": true,
      "provenance_reference": "policy://seamless/v1/kerberos/tgs",
      "rationale": "KDC standard TGS-REQ accepted for accounts with valid SPN",
      "metadata": {}
    },
    {
      "rule_id": "rule-global-kerberos-usable",
      "predicate": "kerberos_authentication_usable",
      "taxonomy": "global",
      "subject_kind": null,
      "target_kind": null,
      "default_value": true,
      "provenance_reference": "policy://seamless/v1/kerberos/auth",
      "rationale": "Kerberos authentication package is functional on domain member systems",
      "metadata": {}
    },
    {
      "rule_id": "rule-global-kerberos-actor-authenticated",
      "predicate": "kerberos_actor_authenticated",
      "taxonomy": "global",
      "subject_kind": null,
      "target_kind": null,
      "default_value": true,
      "provenance_reference": "policy://seamless/v1/kerberos/tgt",
      "rationale": "Authenticated logon session holds a valid Kerberos TGT",
      "metadata": {}
    },
    {
      "rule_id": "rule-typed-admin-channel",
      "predicate": "admin_channel",
      "taxonomy": "typed",
      "subject_kind": null,
      "target_kind": "Computer",
      "default_value": true,
      "provenance_reference": "policy://seamless/v1/host/admin-channel",
      "rationale": "Administrative channel (SMB/WMI/WinRM) is available for local administrators",
      "metadata": {}
    },
    {
      "rule_id": "rule-typed-admin-execution-context",
      "predicate": "admin_execution_context",
      "taxonomy": "typed",
      "subject_kind": null,
      "target_kind": "Computer",
      "default_value": true,
      "provenance_reference": "policy://seamless/v1/host/exec-context",
      "rationale": "Host execution context permits remote code execution for administrators",
      "metadata": {}
    },
    {
      "rule_id": "rule-typed-endpoint-authorized",
      "predicate": "endpoint_authorized",
      "taxonomy": "typed",
      "subject_kind": null,
      "target_kind": "Computer",
      "default_value": true,
      "provenance_reference": "policy://seamless/v1/host/endpoint-auth",
      "rationale": "Target endpoint authorizes connections from designated administrator accounts",
      "metadata": {}
    },
    {
      "rule_id": "rule-typed-host-admin-mapping",
      "predicate": "host_admin_mapping",
      "taxonomy": "typed",
      "subject_kind": null,
      "target_kind": "Computer",
      "default_value": true,
      "provenance_reference": "policy://seamless/v1/host/admin-mapping",
      "rationale": "Local administrator group mapping corresponds to AdminTo entitlement",
      "metadata": {}
    },
    {
      "rule_id": "rule-typed-auth-accepted",
      "predicate": "authentication_accepted",
      "taxonomy": "typed",
      "subject_kind": null,
      "target_kind": null,
      "default_value": true,
      "provenance_reference": "policy://seamless/v1/auth/accepted",
      "rationale": "Target validates and accepts valid domain credentials",
      "metadata": {}
    },
    {
      "rule_id": "rule-typed-winrm-auth-accepted",
      "predicate": "winrm_authentication_accepted",
      "taxonomy": "typed",
      "subject_kind": null,
      "target_kind": "Computer",
      "default_value": true,
      "provenance_reference": "policy://seamless/v1/auth/winrm-accepted",
      "rationale": "WinRM listener validates and accepts administrative credentials",
      "metadata": {}
    },
    {
      "rule_id": "rule-typed-rdp-available",
      "predicate": "rdp_available",
      "taxonomy": "typed",
      "subject_kind": null,
      "target_kind": "Computer",
      "default_value": true,
      "provenance_reference": "policy://seamless/v1/service/rdp",
      "rationale": "Remote Desktop service is enabled and accepting connections",
      "metadata": {}
    },
    {
      "rule_id": "rule-typed-winrm-available",
      "predicate": "winrm_available",
      "taxonomy": "typed",
      "subject_kind": null,
      "target_kind": "Computer",
      "default_value": true,
      "provenance_reference": "policy://seamless/v1/service/winrm-available",
      "rationale": "WinRM PowerShell remoting endpoint is available",
      "metadata": {}
    },
    {
      "rule_id": "rule-typed-directory-write",
      "predicate": "directory_write_allowed",
      "taxonomy": "typed",
      "subject_kind": null,
      "target_kind": null,
      "default_value": true,
      "provenance_reference": "policy://seamless/v1/directory/write",
      "rationale": "Active Directory directory modification allowed under granted ACE rights",
      "metadata": {}
    },
    {
      "rule_id": "rule-typed-password-policy-accepts",
      "predicate": "password_policy_accepts",
      "taxonomy": "typed",
      "subject_kind": null,
      "target_kind": "User",
      "default_value": true,
      "provenance_reference": "policy://seamless/v1/directory/password-policy",
      "rationale": "Password reset value satisfies domain password complexity and length policy",
      "metadata": {}
    },
    {
      "rule_id": "rule-typed-membership-change",
      "predicate": "membership_change_allowed",
      "taxonomy": "typed",
      "subject_kind": null,
      "target_kind": "Group",
      "default_value": true,
      "provenance_reference": "policy://seamless/v1/directory/member-add",
      "rationale": "Modifying group member attribute allowed under granted object control ACE",
      "metadata": {}
    },
    {
      "rule_id": "rule-typed-membership-usable",
      "predicate": "membership_usable",
      "taxonomy": "typed",
      "subject_kind": null,
      "target_kind": "Group",
      "default_value": true,
      "provenance_reference": "policy://seamless/v1/token/member-usable",
      "rationale": "Group SID is incorporated into access token upon session logon",
      "metadata": {}
    },
    {
      "rule_id": "rule-typed-secret-valid",
      "predicate": "secret_valid",
      "taxonomy": "typed",
      "subject_kind": null,
      "target_kind": null,
      "default_value": true,
      "provenance_reference": "policy://seamless/v1/credential/secret-valid",
      "rationale": "Target account secret is current, unexpired, and matches directory password hash",
      "metadata": {}
    },
    {
      "rule_id": "rule-typed-security-group",
      "predicate": "security_group",
      "taxonomy": "typed",
      "subject_kind": null,
      "target_kind": "Group",
      "default_value": true,
      "provenance_reference": "policy://seamless/v1/token/security-group",
      "rationale": "Target group is a security-enabled group capable of token authorization",
      "metadata": {}
    }
  ]
}
